{
    "name": "Neon Frontier",
    "description": "A cyberpunk industrial zone populated by droids and synthetics.",
    "seed": 2077,
    "consts": {
        "W": 64,
        "H": 64,
        "DT": 1.0,
        "G": 0.12,
        "MAX_SPEED": 3.0,
        "SUBSTEPS": 2,
        "DAY_CYCLE": 100,
        "WEATHER_CYCLE": 500,
        "SEASON_CYCLE": 1000,
        "TERRAIN_SEED": 99,
        "TERRAIN_SCALE": 0.8,
        "TERRAIN_SMOOTH": 2,
        "WIND_X": 0.0,
        "WIND_Y": 0.0
    },
    "profiles": [
        {
            "name": "Drones",
            "color": "settler",
            "count": 20,
            "mass_range": [
                1.5,
                2.0
            ],
            "hardness_range": [
                2.0,
                3.0
            ],
            "speed_range": [
                -1.0,
                1.0
            ],
            "depth_range": [
                0.1,
                0.9
            ],
            "energy_range": [
                2.0,
                4.0
            ],
            "wealth_range": [
                0.0,
                0.0
            ]
        },
        {
            "name": "Synthetics",
            "color": "fauna",
            "count": 10,
            "mass_range": [
                1.0,
                1.5
            ],
            "hardness_range": [
                1.5,
                2.5
            ],
            "speed_range": [
                -1.2,
                1.2
            ],
            "depth_range": [
                0.2,
                0.8
            ],
            "energy_range": [
                1.5,
                3.0
            ]
        },
        {
            "name": "Hackers",
            "color": "outsider",
            "count": 8,
            "mass_range": [
                0.8,
                1.2
            ],
            "hardness_range": [
                0.8,
                1.5
            ],
            "speed_range": [
                -0.8,
                0.8
            ],
            "depth_range": [
                0.3,
                0.9
            ],
            "energy_range": [
                1.0,
                2.0
            ]
        },
        {
            "name": "Reactors",
            "color": "habitat",
            "count": 5,
            "mass_range": [
                10.0,
                20.0
            ],
            "hardness_range": [
                5.0,
                10.0
            ],
            "static": true
        },
        {
            "name": "Data Towers",
            "color": "grove",
            "count": 10,
            "mass_range": [
                5.0,
                10.0
            ],
            "hardness_range": [
                3.0,
                6.0
            ],
            "static": true
        }
    ],
    "laws": [
        {
            "name": "gravity",
            "priority": 10,
            "when": "true",
            "actions": [
                "vy += G"
            ]
        },
        {
            "name": "magnetic_drag",
            "priority": 12,
            "when": "true",
            "actions": [
                "drag(0.005)"
            ]
        },
        {
            "name": "hard_collisions",
            "priority": 18,
            "when": "true",
            "actions": [
                "collide(2.0, 0.95, 0.1)"
            ]
        },
        {
            "name": "drone_swarm",
            "priority": 9,
            "when": "color == \"settler\"",
            "actions": [
                "cohere(15, 0.1, color == \"settler\")",
                "align(15, 0.1, color == \"settler\")",
                "separate(5, 0.15, color == \"settler\")",
                "attract(100, 0.4, color == \"habitat\")"
            ]
        },
        {
            "name": "synth_patrol",
            "priority": 8,
            "when": "color == \"fauna\"",
            "actions": [
                "wander(0.1)",
                "avoid(W/2, H/2, 0.05)"
            ]
        },
        {
            "name": "bounds",
            "priority": 20,
            "when": "true",
            "actions": [
                "bounce(W, H, 0.9)"
            ]
        },
        {
            "name": "clamp",
            "priority": 100,
            "when": "true",
            "actions": [
                "clamp_speed(MAX_SPEED)"
            ]
        }
    ]
}